Judul,Tanggal,Url,Artikel,Category
"Perbedaan Mobil Hatchback dan Sedan, Beserta Kelebihan dan Kekurangannya","Selasa, 27 Feb 2024 19:00 WIB",https://oto.detik.com/tips-and-tricks-mobil/d-7214891/perbedaan-mobil-hatchback-dan-sedan-beserta-kelebihan-dan-kekurangannya,"Bagi kamu yang ingin membeli mobil dengan anggaran yang terbatas, mobil hatchback atau sedan bisa menjadi pilihan ekonomis untuk hal ini. Sebagai bahan pertimbangan, kamu bisa kenali dulu perbedaan mobil hatchback dan sedan berikut ini. Ada beberapa perbedaan antara hatchback dan sedan, yang bisa dilihat dari parameter seperti kenyamanan, bahan bakar, ukuran, dan lainnya. Berikut ulasannya. SCROLL TO CONTINUE WITH CONTENT Dikutip dari Acko Drive, mobil hatchback adalah jenis mobil yang dirakit pada bodi dua kotak (two-box design), yakni kompartemen mesin sebagai kotak pertama, dan kompartemen penumpang adalah kotak kedua. Hatchback terdiri dari 4 pintu dan palka di bagian belakang, terbuka ke atas. Bagasi mobil ini terintegrasi ke dalam kompartemen penumpang, dan bisa diakses dari dalam. Mobil sedan adalah jenis mobil yang dirakit dalam bodi tiga kotak. Kompartemen mesin sebagai boks pertama, kompartemen penumpang kotak kedua, dan kotak ketiganya adalah bagasi. Bagasi sedan letaknya terpisah dari kompartemen penumpang, tapi bisa diakses dari pintu belakang. Dengan desain ini, mobil sedan menawarkan lebih banyak ruang bagasi dibandingkan mobil hatchback. Itu tadi penjelasan mengenai mobil hatchback dan sedan. Semoga bisa jadi bahan pertimbangan untuk kalian yang masih bingung. ",Oto
Kata Bos Honda Ketika Ditanya Marquez Bakal Balik Bila RC213V Moncer Lagi,"Selasa, 27 Feb 2024 18:38 WIB",https://oto.detik.com/otosport/d-7214849/kata-bos-honda-ketika-ditanya-marquez-bakal-balik-bila-rc213v-moncer-lagi,"Honda tengah bekerja ekstra keras agar motornya bisa kompetitif lagi. Kalau RC213V kompetitif lagi, akankah Marquez kembali? Begini jawaban bos Honda. Honda boleh dibilang masih dalam situasi terpuruk di MotoGP. Jangankan untuk menyabet titel juara, untuk bersaing di posisi depan saat balapan pun sulit dilakukan. Tapi Honda tak tinggal diam, melainkan terus melakukan perubahan pada motor RC213V. Honda juga bakal memanfaatkan sistem konsesi dalam pengembangan motornya Harapannya motor bisa kompetitif lagi seperti sediakala. Masuk musim 2024, Honda mulai melakukan sejumlah ubahan pada motornya. Motornya berubah total dibandingkan musim lalu. Warnanya berubah kalau dulu didominasi warna oranye kini biru menjadi dominan. Honda juga mengubah sektor mesin, perangkat aerodinamis, dan ukuran motor jadi lebih ramping. SCROLL TO CONTINUE WITH CONTENT ""Dengan mengurangi bobotnya, Anda bisa melakukan pengereman lebih baik, berakselerasi, dan mudah untuk digerakkan saat berganti arah,"" terang Manajer Tim Honda Alberto Puig dalam wawancara dengan AS. Puig meyakini motor tahun ini lebih baik. Akan tetapi, itu saja belum cukup. Dia menyebut akan ada peningkatan lain yang dilakukan pada tunggangan Joan Mir dan Luca Marini itu. Puig juga berterima kasih dengan adanya sistem konsesi yang memungkinkan pabrikan asal Jepang tersebut memperoleh 6 wildcard, 9-10 mesin yang bisa dikembangkan, serta peningkatan aerodinamis. ""Apa yang harus kami kerjakan adalah segala sesuatu yang sedikit lebih buruk harus dioptimalkan agar motor naik level. Jika kami meningkatkan performa mesin tapi tidak pada sasis, kami akan salah. Kami harus mencari benang merah yang mereka bicarakan dan itu masih sulit ditemukan,"" bebernya lagi. Terkait performa Honda yang tengah berusaha jadi lebih baik itu justru memunculkan pertanyaan lain. Pertanyaan itu menyangkut mantan ridernya Marc Marquez yang kini hengkang ke Ducati. Akankah Marc Marquez kembali ketika motor Honda RC213V sudah moncer lagi? Puig tak menjawab dengan gamblang soal potensi Marquez kembali ketika performa Honda sudah cemerlang lagi. ""Saya tidak tahu (Marquez kembali). Kami tengah fokus untuk mengembangkan motor ini. Di samping, jika motornya bekerja, para pebalap pasti ingin datang ke tim,"" pungkas Puig. ",Oto
"Magnetic Clutch pada AC Mobil, Kenali Penyebab dan Ciri-ciri Kerusakannya","Selasa, 27 Feb 2024 18:30 WIB",https://oto.detik.com/tips-and-tricks-mobil/d-7214878/magnetic-clutch-pada-ac-mobil-kenali-penyebab-dan-ciri-ciri-kerusakannya,"Magnetic clutch (kopling magnetik) adalah salah satu bagian komponen AC mobil. Magnetic clutch di sini merupakan katrol yang berputar terus menerus mengikuti mesin. Jika magnetic clutch rusak, kinerja AC mobil tentu akan terganggu. Oleh karena itu, kenali penyebab dan ciri kerusakannya di bawah ini. Dilansir dari situs Suzuki, berikut adalah beberapa penyebab rusaknya magnetic clutch: SCROLL TO CONTINUE WITH CONTENT Kerusakan magnetic clutch bisa disebabkan karena pengemudi mengatur temperatur AC sampai pada level yang terlalu rendah saat berkendara dengan kecepatan tinggi. Hal ini akan menyebabkan kerja magnetic clutch menjadi tidak stabil. Ketika perputaran mesin tinggi, akan ada gesekan kasar pada magnetic clutch. Sehingga membuatnya semakin cepat aus. Oleh sebab itu, sebaiknya saat berkendara dalam kecepatan tinggi dan dalam waktu lama, atur suhu AC sampai maksimal. Kinerja AC juga bergantung pada umur magnetic clutch. Umumnya, rata-rata umur magnetic clutch itu mulai dari 3 bulan sampai 5 tahun. Semakin bagus kualitasnya, maka akan semakin lama juga penggunaannya. Sehingga, magnetic clutch bisa dipakai lebih lama. Secara umum, berikut adalah beberapa indikasi untuk mendeteksi terdeteksi kerusakan magnetic clutch: Itu tadi penjelasan seputar magnetic clutch, mulai dari penyebab dan ciri kerusakannya. Semoga bermanfaat! ",Oto
"Poros Engkol: Pengertian, Fungsi, Cara Kerja, dan Gejala Kerusakan","Selasa, 27 Feb 2024 18:15 WIB",https://oto.detik.com/tips-and-tricks/d-7214859/poros-engkol-pengertian-fungsi-cara-kerja-dan-gejala-kerusakan,"Poros engkol atau crankshaft adalah bagian penting dari mesin kendaraan, baik sepeda motor maupun mobil. Komponen mesin ini menjadi poros dari pergerakan piston. Simak apa itu poros engkol, mulai dari pengertian, fungsi, cara kerja, dan gejala kerusakan poros engkol. Dalam penelitian dari Politeknik Negeri Sriwijaya berjudul Rancang Bangun Alat Penghalus Main Journal Crankshaft (2015), dijelaskan crankshaft atau poros engkol adalah bagian pada mesin yang mengubah gerak vertikal atau horizontal dari piston menjadi gerakan berputar atau berotasi. SCROLL TO CONTINUE WITH CONTENT Poros engkol merupakan poros dari setiap gerakan piston. Keberadaannya penting sebagai komponen dalam suatu mesin pembakaran dalam. Poros engkol ini berada di antara oil pan dengan blok mesin bagian bawah. Dikutip dari buku Teknologi Dasar Otomotif Untuk SMK/MAK Kelas X (2020) oleh Fathun, M.Pd, bahan poros engkol harus tahan terhadap puntiran dan kebengkokkan serta mempunyai sifat luncur yang baik. Dilihat dari bahan dan pembuatannya, poros engkol dibedakan sebagai berikut: Poros engkol dengan tuntutan tinggi yang banyak digunakan pada mesin diesel atau mesin dengan perbandingan kompresi yang tinggi. Bahan pembuatnya adalah baja khusus yang diikuti dengan perlakuan panas untuk meningkatkan kekuatannya. Poros engkol dengan tuntutan sedang banyak digunakan pada mesin bensin atau mesin diesel ringan. Bahan pembuatnya dari besi tuang khusus dengan proses perlakuan panas. Sedangkan pada jurnal dan pena engkol diperkeras dengan lapisan yang tahan terhadap keausan dan mempunyai sifat luncur yang baik dengan perlakuan panas atau kimia, lalu digerinda atau dibubut dengan tekanan kecil. Dikutip dari laman Suzuki Indonesia, berikut ini beberapa fungsi poros engkol: Fungsi utama dari poros engkol adalah sebagai pemindah tenaga, yakni mengubah gerakan naik turun yang dihasilkan oleh piston menjadi gerakan memutar yang kemudian diteruskan ke transmisi. Perubahan gerakan tersebut dibantu komponen transmisi yang menghubungkan energi gerak dari piston ke transmisi untuk diubah cepat. Seperti namanya, poros engkol berfungsi sebagai poros dari gerakan piston. Poros engkol mampu menahan gerakan dan getaran yang tinggi, sehingga bagian lainnya tetap kokoh dari dasar tumpuannya. Poros engkol atau yang disebut kruk pada kendaraan roda empat juga berfungsi sebagai connecting rod. Ketika poros engkol menampung beban berat akan selalu diimbangi dengan kinerja perputarannya yang tinggi, sehingga mesin ini berfungsi sebagai connecting rod. Berdasarkan buku Pemeliharaan Mesin Kendaraan Ringan SMK/MAK Kelas XII (2021) oleh Z Furqon, ST dan Joko Pramono, cara kerja poros engkol utamanya adalah mengubah gerak turun naik piston menjadi gerak putar yang akhirnya menggerakkan roda penerus. Gerakan batang torak dan diubah menjadi gerakan putaran pada poros engkol menghasilkan tenaga atau torque yang kemudian menggerakkan roda kendaraan. Proses terjadi ketika poros engkol menerima beban besar dari piston dan batang piston, serta mengalami gerakan berputar pada kecepatan tinggi. Untuk itu poros engkol biasanya terbuat dari baja karbon dengan tingkatan dan daya tahan yang tinggi. Pada proses ini diperlukan oli pelumas yang cukup untuk mencegah kontak langsung antara logam dengan logam, antara fixed bearing dengan poros engkol selama berputar pada bantalan. Dikutip dari laman Astra-Daihatsu, kerusakan poros engkol umumnya terjadi karena penggunaan kualitas pelumas yang tidak bagus. Kemungkinan lainnya adalah kebocoran pada mesin atau faktor usia komponen yang sudah tua dan mengalami keausan. Beberapa gejala kerusakan pada poros engkol antara lain sebagai berikut: Nah, itulah tadi telah kita ketahui apa itu poros engkol, mulai dari pengertian, fungsi, cara kerja, dan gejala kerusakannya. ",Oto
"MG Raih 1.668 SPK di IIMS 2024, Ini Model yang Terlaris","Selasa, 27 Feb 2024 18:02 WIB",https://oto.detik.com/berita/d-7214823/mg-raih-1-668-spk-di-iims-2024-ini-model-yang-terlaris,"MG mencatatkan performa positif di ajang Indonesia International Motor Show (IIMS) 2024. MG mengklaim mencatat sebanyak 1.668 Surat Pemesanan Kendaraan alias SPK. Dominasi kuat ditunjukkan oleh model MG 4 EV dengan 1.125 SPK, diikuti oleh New MG ZS EV, dan lini kendaraan Internal Combustion Engine (ICE) MG Motor Indonesia. ""Terima kasih Indonesia! Saya ingin menyampaikan rasa syukur atas dukungan luar biasa dari semua pihak yang mendukung MG, termasuk pengunjung IIMS, konsumen MG, serta rekan media. Kami berkomitmen memberikan lebih banyak inovasi ke Indonesia dan telah menyiapkan kejutan di 2024, menawarkan lebih banyak pilihan kendaraan ramah lingkungan. Ini baru permulaan, siapkan diri untuk gebrakan selanjutnya dari kami!,"" ujar Arief Syarifudin selaku Marketing & PR Director MG Motor Indonesia. Selama 11 hari, MG 4 EV menjadi salah satu mobil yang mencuri perhatian. Mobil ini sudah diproduksi secara lokal dan ditawarkan dengan harga spesial Rp 423.000.000 dan garansi baterai seumur hidup untuk 3.000 konsumen pertama. SCROLL TO CONTINUE WITH CONTENT Lebih dari 500 ribu pengunjung IIMS 2024 yang juga mampir mengunjungi booth MG, diklaim tertarik oleh ragam kendaraan listrik yang ditawarkan, mulai dari EV crossover, compact SUV, MPV, hingga station wagon. Kesempatan test drive menarik perhatian besar, dengan MG 4 EV dan New MG ZS EV menjadi bintang utama. Di IIMS 2024, MG juga berhasil meraih penghargaan 'The Best EV MPV' untuk MG Maxus 9 dan 'The Best EV Crossover' untuk MG 4 EV, menegaskan lagi inovasi dan kualitas produk MG di pasar otomotif. Partisipasi dari perwakilan pemerintahan, termasuk Presiden Joko Widodo dan pejabat tinggi lainnya, menunjukkan minat dan dukungan terhadap upaya MG dalam mempromosikan kendaraan ramah lingkungan di Indonesia. Acara ini menjadi bukti tidak hanya dari keberhasilan MG dalam memperkenalkan kendaraan listrik yang inovatif dan terjangkau, tetapi juga dari visi mereka dalam membawa lebih banyak alternatif kendaraan ramah lingkungan ke Indonesia. Penutupan IIMS 2024 menandai awal dari lebih banyak inovasi dan kejutan yang akan dibawa MG ke pasar Indonesia. ",Oto
"Neta Punya Layanan Darurat, Biar Konsumen Tenang di Jalan","Selasa, 27 Feb 2024 17:43 WIB",https://oto.detik.com/detikoto/d-7214770/neta-punya-layanan-darurat-biar-konsumen-tenang-di-jalan,"Infrastruktur yang belum memadai untuk mobil listrik banyak membuat masyarakat berpikir untuk memilikinya. Tapi tak perlu khawatir karena para produsen otomotif Indonesia yang coba mengakomodirnya dengan memberikan fasilitas terbaik. Pabrikan asal China, Neta salah satunya. Neta coba memberikan layanan yang meminimalisir kekhawatiran konsumen saat mengendarai mobil listrik di jalan. PT Neta Auto Indonesia akan memberikan layanan purnajual premium sejak masa kepemilikan. Selain menawarkan Lifetime Warranty dan Gratis Perawatan Berkala hingga 50.000 km, Neta juga menyertai perjalanan konsumen dengan menyediakan layanan Roadside Assistance 24 Jam. Layanan ini akan membantu para konsumen saat mengalami kendala di perjalanan, di mana pun dan kapan saja sehingga konsumen merasa tenang dan yakin saat melakukan perjalanan dengan mengendarai mobil listrik. SCROLL TO CONTINUE WITH CONTENT ""Prioritas kami di Neta adalah mengutamakan kepuasan dan keselamatan pelanggan kami. Dan dengan layanan Roadside Assistance 24 Jam ini, kami ingin memberikan pengalaman kepemilikan Neta yang lebih premium dengan menyediakan dukungan profesional kapan pun dan di mana pun konsumen kami membutuhkannya. Kami harap konsumen akan merasa aman dan percaya bahwa Neta akan selalu ada untuk mendukung aktivitas mereka,"" ujar After Sales Service Operations Manager, Eldi Chandra dalam siaran pers yang diterima detikOto. Berikut layanan Roadside Assistance yang diberikan Neta: 1. Battery Jumper 12V Roadside Assistance akan membantu pengemudi yang mengalami kendala baterai saat di tengah perjalanan dengan memberikan bantuan langsung yaitu layanan Battery Jumper 12V, sehingga pengemudi dapat langsung melanjutkan perjalanan dengan cepat. 2. Flat Tire Support Kendala ban kempis bisa terjadi di mana saja dan kapan saja. Untuk mengatasi masalah ini, Neta menyediakan layanan perbaikan ban kempis langsung di lokasi konsumen. Tim kami akan segera merespons panggilan dan menuju lokasi untuk membantu memperbaiki ban, menjaga keselamatan dan kelancaran perjalanan. 3. Towing ke Bengkel Resmi Melalui Roadside Assistance, Neta akan memberikan layanan penarikan mobil ke bengkel resmi untuk kendala kendaraan yang tidak dapat diselesaikan di tempat. Teknisi terampil kami akan memastikan kendaraan diangkut dengan aman ke bengkel resmi terdekat, di mana kendaraan akan menerima perbaikan dan perawatan dari para profesional. 4. Towing ke SPKLU Terdekat Ada kalanya mobil mengalami kendala kehabisan daya baterai saat di perjalanan dan tidak bisa melanjutkannya. Roadside Assistance akan membantu pengemudi dengan layanan towing ke SPKLU terdekat, sehingga konsumen tetap merasa aman dan nyaman mereka di jalan. ",Oto
Gresini Racing Tak Mau Kehilangan Jati Diri Setelah Kedatangan Marquez,"Selasa, 27 Feb 2024 17:08 WIB",https://oto.detik.com/otosport/d-7214667/gresini-racing-tak-mau-kehilangan-jati-diri-setelah-kedatangan-marquez,"Gresini Racing tidak mau kehilangan identitas setelah berhasil merekrut Marc Marquez dari Honda. Sebagai buktinya, Gresini Racing tetap mempertahankan merek sponsor seperti musim lalu. Gresini Racing tak mau timnya didukung satu sponsor utama, meski itu sangat mudah dilakukan dengan Marquez di timnya. ""Kami tidak ingin kehilangan identitas kami. Kami tidak ingin melakukan perubahan radikal (dari segi sponsor) hanya karena Marc jadi rider kami,"" jelas Direktur Komersial Gresini Racing, Carlo Merlini, dikutip dari Speedweek. Merlini menambahkan, Gresini Racing lebih suka mempertahankan postur sponsor yang ada saat ini. Beberapa sponsor yang menempel di motor Ducati Gresini sudah cukup untuk 'menghidupi' tim Gresini Racing. SCROLL TO CONTINUE WITH CONTENT ""Seperti yang saya katakan, dari sudut pandang finansial, tim ini sangat stabil. Stabilitas ini dapat dicapai, bahkan tanpa sponsor utama. Jadi kami dapat memiliki tiga atau empat sponsor lebih banyak dibandingkan (tim) yang lain. Dari sudut pandang risiko, ini jauh lebih baik (daripada tim dengan satu sponsor utama),"" jelas Merlini. Merlini menegaskan, tim-tim MotoGP dengan sponsor utama mungkin menanggung 70% atau 60% anggaran mereka dengan uang dari sponsor utama. Namun tim-tim yang tidak memiliki sponsor utama seperti Gresini Racing, akan menanggung anggaran tersebut dengan dana yang disediakan oleh beberapa sponsor. ""Kami dapat membaginya kepada lebih banyak sponsor, dan kami mengelolanya dengan cara yang sama,"" kata Merlini. Dengan banyaknya sponsor, maka Gresini Racing tak perlu pusing jika salah satu merek sponsor itu habis kontraknya dan tidak diperpanjang. Sejak beberapa musim terakhir, Gresini Racing punya banyak sponsor, tak terkecuali sponsor-sponsor dari Indonesia, seperti Federal Oil, Aspira, Antangin, MS Glow Men, Bold Riders, dan Riding Style. ",Oto
Kata Konsumen Soal Suzuki Jimny 5 Pintu Buatan India,"Selasa, 27 Feb 2024 16:34 WIB",https://oto.detik.com/mobil/d-7214562/kata-konsumen-soal-suzuki-jimny-5-pintu-buatan-india,"Suzuki Jimny 5 pintu resmi hadir di Indonesia. Mobil SUV kompak ini diluncurkan di ajang Indonesia International Motor Show (IIMS) 2024 beberapa waktu lalu. Beda dengan Jimny 3 pintu yang diproduksi di Jepang, Jimny 5 pintu dirakit di India. Apakah perbedaan negara produksi ini jadi pertimbangan konsumen sebelum membeli Jimny 5 pintu? Afif, salah satu peminat Suzuki Jimny 5 pintu mengatakan, tidak ada masalah dengan Jimny 5 pintu yang diproduksi di India. Sebab Jimny 5 pintu adalah produk global, maka seharusnya secara kualitas sama seperti Jimny 3 pintu yang diproduksi di Jepang.  SCROLL TO CONTINUE WITH CONTENT ""Saya nggak tahu sebenarnya perbedaannya di mana, cuma harusnya dengan pabrikan (Suzuki) yang sama, harusnya nggak banyak masalah (soal kualitas) sih,"" terang Afif, ditemui di arena IIMS 2024, JIExpo, Kemayoran, Jakarta. Pandangan berbeda diutarakan Budi dan Deni. Menurut mereka berdua, Suzuki Jimny 3 pintu buatan Jepang lebih meyakinkan secara kualitas, mengingat standar di Jepang sangat tinggi. ""Modelnya lebih suka ini (Jimny 5 pintu), karena lebih luas. Tapi (kalau harus beli) saya mending (beli) yang (buatan) Jepang,"" ujar Budi. ""Kalau buat saya, Jepang lebih terpercaya kali ya dibanding India. Jadi meragukan juga, kalau inden setahun, terus dari India lagi. Kalau yang 3 pintu, inden lama sudah pasti dapat yang Jepang. Jadi kalau harus memilih, kayaknya saya jadi lebih pilih Jimny 3 pintu, meski kabinnya memang lebih sempit,"" timpal Deni. Sebagai informasi Suzuki Jimny 5 pintu ditawarkan dalam empat varian, yakni Jimny 5 Pintu MT (Single Tone) Rp 462.000.000, Jimny 5 Pintu MT (Two Tone) Rp 465.000.000, Jimny 5 Pintu AT (Single Tone) Rp 475.600.000, Jimny 5 Pintu AT (Two Tone) Rp 478.600.000. ",Oto
"Banyak Orang Indonesia yang Belum Beli Mobil Listrik, Ini Sebabnya","Selasa, 27 Feb 2024 16:08 WIB",https://oto.detik.com/mobil-listrik/d-7214482/banyak-orang-indonesia-yang-belum-beli-mobil-listrik-ini-sebabnya,"PT Honda Prospect Motor (HPM) masih melakukan studi terhadap mobil listrik di Indonesia. Ada beragam tantangan yang ditemukan Honda guna menyesuaikan kebutuhan konsumen Tanah Air. Sales & Marketing and After Sales Director PT Honda Prospect Motor Yusak Billy menyebutkan hasil survei yang telah dilakukan pihaknya terhadap mobil listrik. Ada beragam kemudahan yang ditawarkan mobil listrik di Jakarta, salah satu pendorongnya ialah kebijakan ganjil genap. ""Dari beberapa survei konsumen, kenapa mereka memilih mobil listrik dan beberapa yang tidak mau, di Jakarta banyak yang Fomo (fear of missing out), ganjil genap, ketiga ada subsidi dari pemerintah,"" kata Billy di Kemayoran, Jakarta, belum lama ini. SCROLL TO CONTINUE WITH CONTENT Di sisi lain masih ada juga yang menunda untuk beli mobil listrik. Dari hasil survei Honda, alasannya beragam. ""Ada juga yang menolak, kalau dari infrastruktur belum, kemudian masih ada ketakutan resale value (harga jual kembali), makanya sekarang (mobil listrik) itu mobil ketiga dan keempat,"" kata Billy. ""Kemudian ada juga yang bertanya, masih ingin teknologi yang lebih baik, seperti ngecas sebentar, durasi ingin lama kilometernya. Jadi ada beberapa yang kita pelajari, dan kita akan menuju ke arah sana,"" jelasnya lagi. Honda tidak tinggal diam untuk transisi dari mobil internal combustion engine (ICE) ke mobil listrik. Strategi Honda saat ini menjembatani mobil listrik lewat penjualan mobil hybrid seperti Accord dan CR-V. Di sisi lain, Honda juga melakukan kerja sama untuk studi mobil listrik di Indonesia. Honda telah melakukan uji coba jalan menggunakan Honda N-Van Prototype bekerjasama dengan Pertamina, dengan total perjalanan sejauh 8.375 km yang mencakup area Jakarta, Bekasi, Cikarang dan Bandung. N-Van Prototype ini juga digunakan sebagai kendaraan logistik pengiriman spare part ke berbagai dealer Honda di wilayah Jakarta, Tangerang, Bekasi, Depok dan Cibubur dengan total perjalanan sejauh 2.034 km. Honda juga telah melakukan kolaborasi bersama Universitas Indonesia dengan menyediakan Honda e sebagai sarana transportasi dalam lingkungan kampus, yang telah dicoba oleh lebih dari 1.300 orang selama kurun waktu 6 bulan. Hasil riset mobil listrik N-Van Prototype dan Honda e tidak dipublikasikan. Honda berkomitmen sesuai peta jalan yang sudah dirancang. Honda berkomitmen untuk mengatasi masalah lingkungan dan energi global dengan berusaha mewujudkan netralitas karbon untuk semua produk dan aktivitas perusahaan pada tahun 2050. Untuk mendukung langkah tersebut, Honda juga telah mengumumkan akan memperkenalkan setidaknya 30 model berbasis elektrik secara global hingga tahun 2030, dengan total produksi menjadi 2 juta unit per tahunnya. Soal peluncuran mobil listrik pertama di Indonesia. Billy bilang menunggu waktu peluncuran yang tepat. ""Kami pelajari betul apa yang dihasilkan dari riset itu supaya ke depan teknologi apa yang cocok diterapkan di Indonesia,"" kata Billy ""Kita tahu sekarang ada LFP, ada juga nikel, Mangan, Cobalt, ke depan solid baterai, kita pelajari banyak teknologi ke depan, sekarang terjadi di Jakarta dengan jalanan macet, banjir, hujan, jalanan rusak, behaviour driver seperti apa, menggunakan AC, charging SPKLU seperti apa, apakah semua bisa dicas, itu kita pelajari kebutuhan internal dulu, belum bisa kita disclose,"" tambah Billy. ",Oto
Serbuan Mobil Listrik China Bikin 'Puyeng' Pabrikan Eropa,"Selasa, 27 Feb 2024 15:12 WIB",https://oto.detik.com/mobil-listrik/d-7214292/serbuan-mobil-listrik-china-bikin-puyeng-pabrikan-eropa,"Serbuan kendaraan listrik asal China kini menjadi ancaman bagi pabrikan Eropa. Sebab merek China bisa memperlebar pasar dengan harga yang kompetitif. Diberitakan Forbes, CEO Renault Luca de Meo yakin ancaman dari kendaraan listrik China terhadap pabrikan Eropa begitu mengerikan sehingga diperlukan solusi besar dari pemerintah. Dia berharap bisa menerapkan ""Airbus Industrie"" yang baru--kerja sama hingga kebijakan politik negara Eropa hingga menjadi raksasa dirgantara. Airbus Industrie didirikan pada tahun 1970 untuk membantu Eropa bersaing dengan pemimpin pasar pesawat Boeing dari AS. SCROLL TO CONTINUE WITH CONTENT Uni Eropa telah memutuskan bahwa mobil listrik harus mencapai lebih dari 20% dari pasar mobil baru tahun ini dan menjadi sekitar 80% pada tahun 2030 dan 100% pada tahun 2035. Masalah bagi Eropa adalah produsen China. MG di bawah group SAIC dan BYD, sudah lebih maju dalam membuat EV. Brand asal China itu bahkan bisa memangkas harga 30 persen lebih murah, menurut bank investasi UBS. Tahun lalu China menjual lebih dari 350.000 sedan dan SUV di Eropa, terutama yang listrik, menurut konsultan mobil Prancis Inovev. MG memimpin dengan 239.000 unit. De Meo menyinggung ""Airbus Industires"" dalam pidato di pameran mobil Geneva pada hari Senin, (26/2). Dia mengatakan pembuat mobil Eropa dapat bekerja sama untuk mengembangkan dan membangun mobil yang terjangkau. ""Kita harus kreatif untuk menemukan solusi,"" kata de Meo kepada wartawan, seperti yang dilaporkan oleh Automotive News Europe. Renault meluncurkan Renault 5 di Geneva International Motor Show 2024, sebuah mobil listrik kecil, dengan harga mulai dari sekitar 25.000 atau sekitar Rp 424 jutaan, tidak mendekati harga BYD Seagull dan Wuling Binguo dari China. De Meo mengatakan tantangannya adalah menciptakan rantai pasokan di Eropa yang mencakup baterai, motor listrik, dan elektronik, seperti yang telah dilakukan China dengan dukungan pemerintah. ""Tujuannya adalah untuk mendapatkan segala sesuatu di Eropa dengan harga yang kompetitif. Kita harus kreatif untuk menemukan solusi untuk tantangan membangun EV yang terjangkau di Eropa,"" kata de Meo. Dia bilang pabrikan Eropa harus bergerak cepat. China bisa lebih unggul lantaran bisa membangun rantai pasok dari penambangan bahan baku, suku cadang, hingga jaringan pengisian. China juga lebih mudah beradaptasi dengan aturan. ""Kecepatan itu penting melawan China,"" katanya. ""Kita berada di dunia yang tidak pasti. Di masa lalu, dengan mobil pembakaran internal, Anda dapat meramalkan apa yang akan terjadi. Sekarang, jika Anda membutuhkan empat atau lima tahun untuk bereaksi, sudah terlambat,"" tambahnya lagi. Analis otomotif asal Inggris, Dr Charles Tennant, mengatakan geliat mobil China itu perlu direspons lebih serius jika pabrikan Eropa tidak ingin tertinggal dari merek China soal pengembangan EV. ""Gagasan untuk merespons tantangan ini secara kolektif, Airbus-nya otomotif, masuk akal bagi pabrikan Eropa lama, terutama untuk menekan biaya, di mana biaya produksi mobil China lebih murah hingga 30% dan lebih dari 50% dari seluruh mobil listrik yang terjual secara global pada tahun 2023 dibuat oleh pemain baru yang lebih efisien,"" ujar Tennant. ",Oto
