Judul,Tanggal,Url,Artikel,Category
"Spesifikasi New Mazda CX-3: Harga Mulai Rp 399,9 Juta, Fitur Safety Makin Lengkap","Kamis, 29 Feb 2024 19:36 WIB",https://oto.detik.com/mobil/d-7218725/spesifikasi-new-mazda-cx-3-harga-mulai-rp-399-9-juta-fitur-safety-makin-lengkap,"New Mazda CX-3 resmi meluncur di Indonesia. Mazda CX-3 versi facelift ini hadir dengan harga lebih mahal Rp 20 juta dari versi sebelumnya. New Mazda CX-3 2024 memiliki tampilan lebih sporty dan modern, ditunjang fitur-fitur safety yang semakin lengkap. New Mazda CX-3 tetap mempertahankan desain wajah ikonik, yakni Kodo Design yang merupakan ciri khas mobil-mobil Mazda. Salah satu improvement yang paling menonjol pada bagian eksterior terdapat pada bagian atap mobil, yang kini hadir dengan desain warna two-tone, dengan kombinasi warna hitam yang berkilau, sehingga menampilkan looks yang lebih sporty sekaligus elegan (khusus varian 2.0 pro). Hadir pula sentuhan warna black chrome pada signature wing & warna hitam pada grille, yang berkesinambungan hingga ke bagian dalam headlamp (khusus varian 2.0 pro). Bagian cladding juga tampil dengan warna hitam berkilau, sehingga memunculkan warna hitam yang semakin pekat. New Mazda CX-3 juga memiliki desain velg baru, yang berbentuk seperti palang yang dipilin menambahkan kesan cepat dan dinamis. SCROLL TO CONTINUE WITH CONTENT    Beralih ke interior, New Mazda CX-3 kini hadir dengan jok berbahan kulit pada varian 1.5 sport dan jok berbahan kombinasi kulit dan suede pada varian 2.0 pro. Kursi pada 2.0 pro juga semakin dipercantik dengan aksen Arrow Pattern. Panel dasbor dan door trim pada varian 1.5 sport juga menggunakan bahan suede, sementara pada varian 2.0 pro menggunakan bahan kulit dengan aksen dot pattern. Bagian louver ring atau bingkai kisi-kisi AC juga diberikan sentuhan warna merah dan perak pada varian 1.5 sport, serta warna coper dan hitam pada varian 2.0 pro. Baik varian 1.5 sport dan 2.0 pro, keduanya juga sudah dilengkapi dengan sunroof, auto dimming interior mirror, auto headlamp, dan auto wiper.    Cat Khas Takumi-Nuri New Mazda CX-3 varian 1.5 sport hadir dengan tujuh pilihan warna, sedang New Mazda CX-3 varian 2.0 pro hadir dengan empat pilihan warna. Salah satu pilihan warna terbaru yang termasuk dalam kedua varian adalah Aero Grey Metallic, yang terinspirasi dari dinamika udara saat mobil sedang berada di dalam di wind tunnel. Warna terbaru ini diyakini mampu memberikan nuansa modern, yang membedakan The New Mazda CX-3 dengan mobil-mobil lainnya di pasaran. Untuk proses pengecatan warna premium, seperti Soul Red Crystal Metallic, Machine Grey Metallic, dan Polymetal Grey Metallic, Mazda telah mengaplikasikan teknologi khusus, seolah diwarnai langsung oleh tangan pengrajin terampil. Keistimewaan ini disebut dengan istilah Takumi-Nuri, yang berarti 'Artisan Colouring'. Keunggulan proses pengecatan ini, mampu memberikan visual yang estetik, dengan kesan yang kuat, dan penuh energi. Fitur Fungsional dan Mesin Bertenaga, Mewujudkan Filosofi Jinba-Ittai New Mazda CX-3 varian 1.5 sport menggunakan mesin Skyactiv-G 1.5L, memberikan tenaga sebesar 111 PS dan torsi sebesar 144 Nm. Sementara, New Mazda CX-3 varian 2.0 pro hadir dengan mesin yang lebih powerful, yaitu Skyactiv-G 2.0, dengan tenaga mencapai 149 PS dan torsi 195 Nm. Salah satu fitur unggulan dari New Mazda CX-3 adalah G-Vectoring Control, yang sukses mewujudkan filosofi Jinba-Ittai dalam setiap momen berkendaranya. Fitur ini dirancang untuk meningkatkan responsivitas kendaraan dan kenyamanan pengemudi serta penumpang. G-Vectoring Control diklaim bisa mengurangi gaya gravitasi yang dirasakan oleh pengemudi dan penumpang saat mobil menikung, dengan cara menyesuaikan torsi pada mesin.    Fitur-fitur Keselamatan Dengan menyempurnakan teknologi i-Activsense pada edisi sebelumnya, New Mazda CX-3 membawa aspek keselamatan berkendara ke level baru, sehingga mampu bersaing dengan para kompetitor pada kategori segmen serupa. Fitur unggulan i-Activsense yang pertama adalah, Mazda Radar Cruise Control (MRCC), yang memungkinkan pengemudi menjaga kecepatan konstan di perjalanan. Sistem ini secara otomatis menyesuaikan kecepatan mobil dengan mobil di depan, menjaga jarak aman, dan memberikan kenyamanan terutama pada saat perjalanan jauh. Kedua, fitur Lane Departure Warning System, yang membantu pengemudi dengan memberi peringatan jika kendaraan keluar dari jalur tanpa disengaja. Begitu pula dengan Smart Brake Support, yang tidak hanya memberikan peringatan, namun juga dapat melakukan pengereman otomatis jika terdeteksi risiko tabrakan di depan. Driver Attention Alert juga merupakan fitur keselamatan yang penting, membantu mengingatkan pengemudi saat mereka kehilangan fokus atau menunjukkan tanda-tanda kelelahan. Sementara, Blind Spot Monitoring dan Rear Cross Traffic Monitoring, dapat membantu mengurangi resiko kecelakaan dengan memberikan peringatan saat ada kendaraan di samping, atau saat mundur dari parkiran.    Harga dan Pilihan Warna New Mazda CX-3 1.5 sport dipasarkan Rp 399.900.000 on the road Jakarta dengan pilihan warna Soul Red Crystal Metallic, Machine Grey Metallic, Polymetal Grey Metallic, lalu Platinum Quartz Metallic, Aero Grey Metallic, Snowflake White Pearl, dan Jet Black Mica. Sementara New Mazda CX-3 2.0 pro dijual Rp 495.500.000 dengan pilihan warna Soul Red Crystal Metallic, Polymetal Grey Metallic, Aero Grey Metallic, Platinum Quartz Metallic. 5 Years MyMazda Warranty dan 3 Years MyMazda Service Setiap pembelian unit Mazda dengan VIN tahun 2024, termasuk New Mazda CX-3 telah dilengkapi dengan program layanan purna jual 5 Years MyMazda Warranty dan 3 Years MyMazda Service. 5 Years MyMazda Warranty adalah program garansi terbaru dari Mazda Indonesia, yang berlaku selama 5 tahun atau 150.000 km (mana yang tercapai lebih dahulu). Program ini melengkapi layanan purnajual yang telah tersedia sebelumnya, 3 Years MyMazda Service, yang mencakup jaminan servis (parts dan labor), selama 3 tahun atau 60.000 km (mana yang tercapai lebih dahulu).  Menyambut peluncuran program layanan purna jual 5 Years MyMazda Warranty, Igor Panjaitan, selaku Customer Service Director Euro Motors Indonesia juga menambahkan, ""Peluncuran program 5 Years MyMazda Warranty adalah bentuk komitmen PT Eurokars Motor Indonesia untuk meningkatkan kepuasan dan kepercayaan para pemilik kendaraan Mazda. Misi kami adalah untuk memastikan bahwa setiap pelanggan dapat merasakan kenyamanan dan ketenangan pikiran selama mengendarai mobil Mazda milik mereka. Bersama dengan layanan 3 Years MyMazda Service yang telah tersedia, kami yakin bahwa berkendara mobil Mazda tidak hanya akan memberikan pengalaman yang menyenangkan, tetapi juga memberikan rasa kepercayaan diri yang tinggi."" The New Mazda CX-3 sudah tersedia di seluruh 26 jaringan dealer Mazda yang tersebar di seluruh Indonesia, serta di acara BCA Expoversary 2024, yang diselenggarakan pada tanggal 29 Februari - 3 Maret 2024, di ICE BSD Hall 1 - 10. Dapatkan berbagai penawaran menarik dan program pembiayaan terbaik, serta merchandise eksklusif dari Mazda, pada acara ini. ",Oto
Survei Internal Honda: Pembeli Mobil Listrik Kebanyakan FOMO,"Kamis, 29 Feb 2024 19:09 WIB",https://oto.detik.com/mobil-listrik/d-7218697/survei-internal-honda-pembeli-mobil-listrik-kebanyakan-fomo,"PT Honda Prospect Motor (HPM) telah melakukan survei mengenai karakter konsumen mobil listrik di Indonesia. Mereka memastikan, pembeli kendaraan nonemisi kebanyakan berasal dari kalangan yang fear of missing out (FOMO) atau tak mau ketinggalan tren. Yusak Billy selaku Direktur Pemasaran PT HPM mengatakan, konsumen mobil listrik yang FOMO masih lebih banyak dibandingkan mereka yang ingin merasakan sensasi baru dalam mengemudi. ""BEV (battery electric vehicle) seperti yang saya pernah ngomong di IIMS kemarin, survei kami di internal (kebanyakan) masih FOMO. Kemudian nomor dua kita lihat (karena pertimbangan) ganjil-genap. Ketiga driving experience berbeda dan terakhir cost-nya,"" ujar Yusak Billy di Cikini, Jakarta Pusat, Kamis (29/2). SCROLL TO CONTINUE WITH CONTENT Bukan hanya meriset mereka yang minat, Honda juga turut mencari tahu alasan mengapa konsumen belum tertarik membeli mobil listrik. ""Jawaban mereka seputar infrastruktur, resale value, sekarang kan yang beli masih (sebagai) mobil kedua, ketiga atau keempat. Mereka juga masih menunggu teknologi baru, karena kan susah nge-charge, lama, kalau satu jam bisa 1.000 km, kan banyak teknologi,"" ungkapnya. Lebih jauh, Yusak menjelaskan, tingkat kepemilikan mobil pribadi di Indonesia masih sangat rendah, yakni 99 dari 1.000 orang. Itulah mengapa, produsen perlu mempelajari banyak hal sebelum meluncurkan produk baru, terutama mobil listrik. Kini, harga mobil listrik masih sangat tinggi. Sementara kendaraan yang paling banyak diminati konsumen adalah model first buyer. ""(Soal mobil listrik yang cocok dengan orang Indonesia) tergantung target pasarnya. 99 dari 1.000 orang kan masih berkembang. Masih perlu tumbuh dan segmen mana yang perlu berkembang kita pelajari, apakah first time buyer, mobil kedua atau ketiga,"" kata dia. Sebagai catatan, PT HPM sudah mengenalkan dua mobil listrik di Indonesia, yakni Honda e dan N Van. Namun, kedua kendaraan tersebut belum diluncurkan apalagi dijual secara massal. Menurut mereka, sebelum sampai ke tahap elektrik penuh, produsen butuh jembatan berupa mobil hybrid. ",Oto
5 Masalah Mobil yang Sering Terjadi saat Berkendara di Cuaca Ekstrem,"Kamis, 29 Feb 2024 18:04 WIB",https://oto.detik.com/tips-and-tricks-mobil/d-7218694/5-masalah-mobil-yang-sering-terjadi-saat-berkendara-di-cuaca-ekstrem,"Hujan deras turun di pulau Jawa selama beberapa hari. Bagi pengendara mobil, kenali lima masalah mobil yang sering terjadi saat berkendara di cuaca ekstrem. Pusat Riset Iklim dan Atmosfer Badan Riset dan Inovasi Nasional (BRIN), mengungkapkan pulau Jawa berpotensi mengalami cuaca ekstrem berupa hujan deras. Kondisi ini turut berdampak pada kendaraan yang berisiko menjadi lebih rentan akibat suhu udara lembab, serta jalanan yang licin. Dijelaskan Hankook Tire dalam keterangan resminya, ada lima masalah mobil yang berpotensi terjadi saat berkendara di cuaca ekstrem. Antara lain: SCROLL TO CONTINUE WITH CONTENT Wiper mobil tidak berfungsi Beberapa faktor dapat menyebabkan wiper mati, mulai dari karet yang sudah aus, sistem engkol yang kotor, hingga kabel penggerak yang sudah usang. Agar terhindar dari situasi wiper kendaraan tidak berfungsi secara optimal, Anda dapat melakukan beberapa langkah seperti periksa kondisi wiper secara rutin terutama sebelum musim hujan, ganti sekring wiper dengan yang baru jika diperlukan, gunakan juga air wiper yang berkualitas dan sesuai dengan spesifikasi mobil, lalu ganti karet wiper secara berkala, biasanya setiap enam bulan sekali. Aki mobil mati Suhu udara yang lebih rendah dan kelembapan yang meningkat dapat menyebabkan aki bekerja dua kali lipat, terutama saat menghidupkan mesin. Komponen mobil seperti lampu kabut, unit AC, sound system, dan wiper juga mengkonsumsi lebih banyak tenaga dari aki, yang mengakibatkan kapasitasnya berkurang drastis. Cek aki mobil sebelum berkendara, terutama jika akan melakukan perjalanan ke luar kota. Batasi penggunaan aki jika sudah berusia 2-3 tahun atau sudah menempuh jarak 50.000 km. Kaca mobil berembun Cuaca dingin dan hujan sering menyebabkan embun terbentuk di kaca. Penyebab lainnya adalah kelembapan dalam kabin mobil karena paparan partikel air dari pendinginan udara AC. Sebelum mengganggu visibilitas dan keamanan berkendara, lakukan service AC tiap tiga bulan sekali untuk mencegah proses pengembunan. Manfaatkan fitur resirkulasi pada mobil untuk mengalirkan udara dari luar ke dalam tanpa mengubah suhu AC, sehingga mencegah perbedaan suhu yang dapat membuat embun terbentuk di kaca mobil. Rem tidak pakem Ketika berkendara di atas permukaan jalan yang basah, sistem pengereman mungkin menjadi kurang responsif. Air yang terjebak di antara kampas rem dan cakramnya dapat mengganggu kontak antara kedua komponen tersebut. Untuk menghindari kondisi tersebut, pengendara disarankan melakukan perawatan secara rutin untuk memeriksa kondisi minyak rem dan menggantinya, terutama jika mobil sudah mencapai 40.000 km. Selain itu, ban yang sudah aus juga dapat mengurangi traksi sehingga membuat mobil sulit berhenti dalam kecepatan tinggi. Pada ban sudah ada simbol Tread Wear Indicator (TWI) untuk membantu pengendara mengukur batas keausan yang diperbolehkan. Jika kembang ban telah mencapai segitiga TWI, sebaiknya segera mengganti ban. Risiko aquaplaning Aquaplaning adalah kondisi ketika ban mobil kehilangan kontak dengan aspal karena genangan air. Ini mengakibatkan hilangnya traksi dan ketidakstabilan kendaraan. Hal ini disebabkan oleh ketebalan genangan air dan kecepatan mobil yang tinggi, yang membuat alur ban tidak mampu mengalirkan air dengan efektif. Untuk mencegah aquaplaning, hindari kecepatan di atas 60 km/jam saat hujan. Pastikan juga kondisi ban tidak botak, karena hal ini dapat mengakibatkan ban tidak mampu melakukan pembuangan air dan menyulitkan pengereman, sehingga mobil kehilangan kendali. ",Oto
MotoGP Rilis Komunikasi Tim Jorge Martin saat Berupaya 'Jegal' Pecco,"Kamis, 29 Feb 2024 17:40 WIB",https://oto.detik.com/otosport/d-7218585/motogp-rilis-komunikasi-tim-jorge-martin-saat-berupaya-jegal-pecco,"Kanal YouTube MotoGP merilis komunikasi tim Jorge Martin saat sesi Practice balapan MotoGP Valencia 2023. Komunikasi itu menggambarkan taktik tim Jorge Martin untuk 'menjegal' kemenangan Francesco 'Pecco' Bagnaia dan mengantarkan Martin jadi juara dunia. Namun sampai balapan berakhir, Pecco-lah yang keluar sebagai Juara Dunia MotoGP 2023. Dalam komunikasi itu, tim Jorge Martin memiliki taktik untuk 'menjegal' kemenangan Pecco di sesi Practice MotoGP Valencia 2023 yang jadi seri pemungkas MotoGP 2023. Seri itu merupakan seri penentu dalam perebutan gelar juara dunia 2023. Taktik yang digunakan adalah memantau gerak-gerik tim Pecco dan meminta Martin terus berada di belakang Pecco atau dikenal dengan teknik 'towing'. Salah satu kru Jorge Martin, Fonsi Nieto (teknisi Martin di Pramac Racing), diminta untuk memantau gerak-gerik tim Pecco selama di garasi. SCROLL TO CONTINUE WITH CONTENT ""Fonsi, tetap di pit wall dan tetap pantau jika mereka (tim Pecco) mengganti ban Pecco dan jika dia siap untuk time attack,"" kata salah satu kru Martin meminta pergerakan tim Pecco selalu dipantau. ""Sekarang Fonsi, kami siap. Kamu akan memberikan lampu hijau kepada kami. Ketika Pecco keluar (dari garasi), kita juga akan melakukannya. Beri kami lampu hijau, kami siap. Semuanya tunggu sinyal dari Fonsi,"" sambungnya. Fonsi memantau tim Pecco melakukan penggantian ban motornya. Sampai, tampak Pecco siap keluar dari garasinya untuk melakukan time attack di sesi Practice. Tim Martin meminta Martin untuk mengikuti Pecco segera keluar dari garasinya. Pecco keluar duluan, diikuti Martin di belakangnya. Nahas, ketika itu Jack Miller mengalami kecelakaan sehingga memaksa bendera merah (red flag) dikibarkan tanda sesi disetop sementara. Pecco dan Martin yang tengah melaju di pitlane harus kembali ke garasinya. Tim Martin langsung meminta kru untuk menyiapkan pemanas ban, khususnya untuk ban depan, agar suhunya tepat dan siap digunakan. Saat Martin dan Pecco kembali ke garasi, Fonsi tetap diminta untuk memantau pergerakan tim Pecco. Disebutkan, Martin harus keluar bersama Pecco ketika sesi Practice kembali dibuka. ""Radiator (kemungkinan kode tim untuk menyebut nama Pecco) keluar dan siap,"" ujar Fonsi mengabarkan kepada kru lainnya. Ketika itu juga, tim Martin langsung buru-buru menyiapkan motornya agar bisa keluar bersama Pecco. Namun, Pecco tidak tepat berada di depan Martin. Ada rider lainnya di antara Pecco dan Martin di pitlane. Tim Martin tidak ingin strategi towing diketahui Pecco. Sampai-sampai, mereka tetap menyembunyikan pitboard-nya. ""Kamu harus tetap menyembunyikan pit board, Spada! Karena Pecco belum menyadarinya. Sampai dia menyadarinya, kamu harus tetap menyembunyikan pit board. Jangan lakukan apa pun! Ketika Pecco masuk ke pit lane, Martin pun tetap mengikutinya. Kru diminta untuk menyiapkan segala hal agar Martin bisa keluar bareng Pecco lagi dari garasi. Sambil menunggu Pecco keluar dari garasinya, kru Martin memasang penghangat ban agar ban tetap siap digunakan. Strategi 'towing' itu masih dilakukan tim Martin. Hingga akhirnya, sesi Practice selesai. Martin menjadi pebalap kedua tercepat di bawah Maverick Vinales. Sedangkan Pecco hanya menempati posisi ke-15. Hal ini membuat Pecco harus mengikuti kualifikasi 1 (Q1) terlebih dahulu sebelum masuk ke kualifikasi 2 (Q2) untuk merebut pole position. Sementara itu, Martin langsung tembus ke Q2 berkat hasil Practice. Pada prosesnya, Pecco tembus ke Q2 setelah menjadi pebalap tercepat pertama di Q1. Di Q2, Pecco jadi pebalap tercepat kedua di bawah Maverick Vinales, sedangkan Martin di urutan keenam. Sanksi yang diberikan kepada Vinales membuat Pecco start dari grid terdepan di balapan. Saat sesi Sprint Race, Jorge Martin berhasil jadi juara. Sayangnya, pada balapan utama hari Minggu, Martin crash dan Pecco Bagnaia jadi juara.  [Gambas:Youtube]  Aksi Jorge Martin mengganggu Pecco sehingga gagal menembus Q2 di Practice MotoGP Valencia 2023 dikritik Bos Ducati Davide Tardozzi. Sebagian menganggap aksi tersebut merupakan mind game yang dilakukan Martin kepada sang rival karena masih tertinggal 21 poin. Tardozzi begitu kesal karena aksi yang dilakukan Jorge Martin. Tardozzi tampak berdiri seolah menghalangi laju Martin saat hendak keluar dari garasi untuk mengikuti sesi akhir latihan. Menurut Tardozzi, aksi yang dilakukan Martin itu mirip dengan Marquez. Sejatinya kata Tardozzi hal ini tidak pantas dilakukan dan tak baik bagi rider. ""Aksi itu sama seperti yang sering dilakukan Marc Marquez, tapi itu memang bisa dilakukan. Saya pikir Martin mencoba untuk melakukan satu ini karena dia ingin menang di kedua balapan, ya mungkin saja dia bisa, saya tidak tahu. Tujuan kami adalah membawa pulang poin yang kami butuhkan untuk kejuaraan. Semoga yang terbaik yang menang,"" kata Tardozzi dilansir Motosan. ""Di situasi tertentu, saya mengkritik itu (aksi towing) di masa lalu dan saya masih terus mengkritisinya karena menurut saya di level kejuaraan situasi itu tidak pantas dan tidak mendidik bagi pebalap,"" ucap Tardozzi. Di lain pihak, Martin merasa tidak melakukan kesalahan meski beberapa kali membuntuti Pecco. Bagi Martinator sudah sering Pecco dibuntuti oleh para rider sepanjang musim ini. ""Saya lihat mereka agak kesal. Tapi saya tidak punya pilihan. Saya tidak mendorongnya keluar lintasan atau hal seperti itu, saya hanya mengikuti dia. Kita semua lihat beberapa kali beberapa pebalap membuntuti saya atau Pecco dan mereka tak mengatakan apa pun. Saya ingin Anda lebih santai dan memahami situasi saya. Saya rider Ducati, jika saya menang itu untuk tim dan untuk Ducati juga. Saya harap mereka juga senang kalau saya menang,"" ucap Martin. ",Oto
"Spesifikasi Mitsubishi Fuso Euro 4, Truk Tangguh dan Ramah Lingkungan","Kamis, 29 Feb 2024 17:12 WIB",https://oto.detik.com/mobil/d-7218565/spesifikasi-mitsubishi-fuso-euro-4-truk-tangguh-dan-ramah-lingkungan,"PT Krama Yudha Tiga Berlian Motors (KTB) sebagai distributor resmi kendaraan niaga Mitsubishi Fuso Truck and Bus Corporation (MFTBC) di Indonesia memasarkan sejumlah jajaran produk terbarunya. Produk tersebut adalah jajaran truk Mitsubishi Fuso Euro 4, yaitu 15 varian Canter dan 14 varian Fighter X. Jajaran truk terbaru ini dinilai mampu menghasilkan emisi gas buang yang ramah lingkungan karena teknologi Exhaust Gas Recirculation, Positive Crankcase Ventilation, dan Diesel Oxidation Catalyst Muffler mampu menurunkan kadar emisi NOx (nitrogen oxide). Tak hanya itu, Mitsubishi FUSO Euro 4 juga terbukti mampu memberikan performa, tenaga, dan torsi mesin optimal karena adanya penggunaan teknologi Common Rail System yang dikontrol oleh Electronic Control Unit (ECU). SCROLL TO CONTINUE WITH CONTENT ""Kami berkomitmen untuk terus mempertahankan dan meningkatkan dukungan layanan kepada pelanggan di seluruh Indonesia,"" kata Presiden Direktur PT Krama Yudha Tiga Berlian Motors Nobukazu Tanaka. Mitsubishi mengklaim performa mesin model baru ini lebih bertenaga mulai dari 108 PS-150 PS pada Canter serta penyesuaian pada final gear ratio untuk performa optimal. Adapun keunggulan utama dari varian baru tersebut adalah peningkatan dimensi kendaraan sesuai dengan kebutuhan konsumen, yakni penambahan panjang chassis (Cab to End) pada varian 6x4 FN26FL HD menjadi 9,8 meter yang berpengaruh terhadap volume angkut serta peningkatan Gross Vehicle Weight (GVW) dan Rear Overhang (ROH) untuk mengangkut muatan lebih banyak. Mitsubishi juga menyematkan fitur keselamatan yang lebih aman melalui penggunaan full air brake system dan penambahan anti-lock braking system pada seluruh varian Fighter X. Fuso mengklaim sekitar 80 persen suku cadang Canter dan Fighter X memiliki kesamaan dengan yang ada di line up sebelumnya. Truk ini juga telah dilengkapi fitur telematik bernama RUNNER yang dapat membantu pemilik kendaraan dalam memantau aktivitas pengiriman secara jarak jauh. Mitsubishi Fuso juga akan mempertahankan layanan free service yang selama ini diapresiasi konsumen hingga setelah peluncuran kendaraan baru ini. Untuk perawatan kendaraan, Anda bisa memesan layanan home service atau melalui bengkel resmi Mitsubishi Fuso. Jadi, tidak perlu khawatir ketika kendaraan Anda mengalami masalah, langsung bawa ke dealer resmi untuk mengklaim garansi kendaraan. Temukan kendaraan tangguh untuk menunjang kinerja bisnis Anda di akun Instagram resmi Bumen Redja Abadi Latumenten @bumenredjabadi_latumenten atau bisa juga melakukan transaksi di Tokopedia Official Store 'FUSO BRA'. Informasi lebih lanjut tentang Mitsubishi Canter & Fighter X lainnya bisa Anda dapatkan dengan menghubungi dealer resmi PT Bumen Redja Abadi Latumenten Jakarta Barat di nomor (021) 6312381 atau https://wa.me/6281119085202, dan PT Bumen Redja Abadi Kelapa Gading di nomor (021) 4515239-40 Tunggu apalagi, BRAthers? Yuk, ambil smartphone Anda dan cari tahu lebih lanjut tentang Mitsubishi PT Bumen Redja Abadi! ",Oto
"Harga Mulai Rp 500 Jutaan, Fuso Canter Bus Ditargetkan Laku Segini","Kamis, 29 Feb 2024 17:09 WIB",https://oto.detik.com/berita/d-7218562/harga-mulai-rp-500-jutaan-fuso-canter-bus-ditargetkan-laku-segini,"PT Krama Yudha Tiga Berlian Motors (KTB) sudah memperkenalkan Mitsubishi Fuso Canter Bus dalam ajang Gaikindo Indonesia International Auto Show (GIIAS) 2023. Konsumen yang meminang Fuso Canter Bus itu harus menunggu dua hingga tiga bulan. ""Kami bahkan inden, jadi produksinya baru dimulai pada Desember (2023) kemarin. Beberapa permintaan belum bisa kami penuhi karena masih menunggu ketersediaan barang,"" ujar Aji Jaya, Director of Sales & Marketing Division PT Krama Yudha Tiga Berlian Motor (KTB) di Pulomas, Jakarta Timur, Kamis (29/2/2024). Aji menambahkan Canter Bus yang dirancang bersama karoseri Trijaya Union itu ditargetkan laku puluhan unit per bulannya. SCROLL TO CONTINUE WITH CONTENT ""Berapa (penjualan) per bulannya? Targetnya 20 sampai 50 unit. Tapi sekarang kan baru awal, jadi menuju ke sana,"" kata Aji. Varian Canter Bus terbaru ini menggunakan sasis FE71 Long. Walhasil Canter Bus ini memiliki ruang yang lebih lega, bisa mengangkut hingga 19 penumpang plus sopir. Untuk menunjang kenyamanan, Fuso Canter Bus juga hadir dengan bagasi yang lebih luas. Bangku baris belakangnya bisa digeser dan dilipat. Dalam fitur keselamatan semua kursi penumpang juga dilengkapi dengan sabuk pengaman dua titik. Fuso Canter Bus ini dibekali diesel 3.907 cc dengan kode mesin 4V21-2AT4 yang di atas kertas bisa memuntahkan tenaga sebesar 108 PS di 2.500 rpm dan torsi 304 Nm. Lantas berapa harga yang harus dibayarkan untuk meminang Fuso Canter Bus ini? ""Harga dealer yang menentukan, kalau kita range-nya sekitar Rp 500 juta sampai Rp 600 jutaan,"" kata Aji. ""Kalau mau beli mobil itu biasanya ada BBN yang berbeda tiap daerah, makanya saya nggak bisa bilang berapa harganya. Tapi kita kasih range-nya itu,"" sambungnya lagi. ",Oto
