Judul,Tanggal,Url,Artikel,Category
Cara Suzuki Buat 1.300 Pengunjung IIMS 2024 Cicipi Jimny 5 Pintu,"Sabtu, 24 Feb 2024 18:57 WIB",https://oto.detik.com/mobil/d-7210208/cara-suzuki-buat-1-300-pengunjung-iims-2024-cicipi-jimny-5-pintu,"Meski ada kabar tak sedap dengan adanya oknum sales yang 'goreng' harga jual Suzuki Jimny 5 penumpang. Rupanya hal tersebut tidak membuat pengunjung Indonesia International Motor Show (IIMS) 2024, kapok untuk merasakan ketangguhan mobil para petualang Suzuki Jimny 5 pintu. Rasa antusias pengunjung IIMS 2024 akan Suzuki Jimny 5 pintu, tidak lepas dari track uji coba menantang yang disajikan. 4W Marketing Director PT SIS, Harold Donnel, mengatakan bahwa selama IIMS 2024 ini, Suzuki menghadirkan konsep adventure untuk memberikan pengalaman yang berkesan bagi seluruh pengunjung. ""Pada tahun ini kami tidak hanya menghadirkan booth dan unit test drive saja, Suzuki juga menyiapkan arena dengan thematic display bernuansa urban dan petualangan yang dapat merepresentasikan bahwa produk terbaru dari Suzuki dapat diandalkan menjadi mobil untuk menemani liburan atau aktivitas hobi dari si pemilik kendaraan. Untuk memberikan pengalaman yang lebih memuaskan, Suzuki sediakan outdoor thematic arena yaitu Jimny Adventure Experience yang dapat dicoba oleh pengunjung untuk merasakan performa offroad menggunakan Jimny 5-door yang dikemudikan oleh offroader professional,""ungkap Harold. SCROLL TO CONTINUE WITH CONTENT Berbagai komentar disampaikan pengunjung yang hendak melakukan uji coba Suzuki Jimny 5 pintu. Ditemui di arena outdoor Jimny Adventure Experience, Panji (41) mengatakan sangat puas dengan pengalaman yang diberikan dengan konsep taxi-ride Jimny 5-door ketika melintasi track dengan beragam obstacle menantang yang telah disiapkan. ""Saya tertarik untuk mencoba area ini karena melihat obstacle yang dihadirkan pastinya bisa membuktikan langsung performa Jimny 5-door ini. Secara keseluruhan, saya merasa sangat nyaman dan puas karena saat saya duduk di baris kedua, saya merasa suspensinya empuk pada saat melintasi kondisi jalanan yang tidak rata maupun bergelombang. Kebetulan juga saya tergabung di komunitas Jimny JB74.id dan juga penikmat kendaraan untuk adventure dan roadtrip. Sehingga dengan Jimny 5-door ini, bisa mengakomodir kebutuhan saya ketika melakukan aktivitas hobi seperti kapasitas penumpang yang memadai dan dapat menampung barang bawaan yang dibutuhkan,""jelas Panji. Hal senada juga disampaikan Kevin (23), berkat desain dan fitur yang ditawarkan Suzuki Jimny 5 pintu dia merasakan bahwa Jimny menjadi pilihan yang tepat karena bisa mendapatkan kendaraan yang memiliki performa offroad dengan harga yang ekonomis. ""Saya memutuskan untuk membeli Jimny ini karena memiliki model klasik yang bisa digunakan untuk aktivitas offroad tapi dengan harga yang cukup ekonomis. Tadi juga saya mencoba langsung di area test drive dan arena outdoor Jimny Adventure Experience dan rasanya sangat nyaman. Jadi meskipun indent, saya tetap tertarik untuk beli unit ini dengan pilihan transmisi otomatis (AT), agar tidak hanya digunakan untuk menyalurkan hobby namun tetap dapat dijadikan sebagai city car untuk menerjang jalanan perkotaan,""ungkap Kevin. Di IIMS Suzuki berada di Hall A2 JIExpo Kemayoran, Suzuki juga memamerkan unit unggulan lainnya termasuk kendaraan hybrid yang ramah lingkungan serta kendaraan lainnya untuk memenuhi kebutuhan setiap pelanggan. Melihat animo masyarakat yang tinggi terhadap unit hybrid, Suzuki pun meluncurkan unit All New Ertiga Hybrid Cruise yang memiliki inovasi pada bagian eksteriornya. Untuk dapat merasakan langsung pengalaman berkendara dengan unit hybrid, Suzuki juga menyiapkan unit Grand Vitara, New XL7 Hybrid dan All New Ertiga Cruise pada area test drive regular yang dapat dicoba dengan mudah oleh seluruh pengunjung.""Melalui inovasi baik produk serta pelayanan yang diberikan Suzuki, kami hendak mengakomodir seluruh kebutuhan konsumen. Sehingga pada IIMS 2024 ini kami berusaha menghadirkan booth dan aktivitas yang menarik, dan ternyata kami menerima respon yang positif dari pengunjung booth Suzuki. Saat ini sudah lebih dari 1.300 orang mencoba Jimny Adventure Experience, dan tentunya kami sangat berterima kasih terhadap antusiasme masyarakat dan berharap dapat terus memberikan kepuasan kepada seluruh pelanggan melalui inovasi yang akan terus dilakukan,""tutup Harold. ",Oto
Langkah Inisiatif Mitsubishi Bangun Dunia Pendidikan,"Sabtu, 24 Feb 2024 16:43 WIB",https://oto.detik.com/mobil/d-7210000/langkah-inisiatif-mitsubishi-bangun-dunia-pendidikan,"Industri otomotif Indonesia tidak pernah lepas dari dunia pendidikan, menyadari hal tersebut PT Mitsubishi Motors Krama Yudha Sales Indonesia (MMKSI), berniat untuk terus meningkatkan kualitas dari para siswa Sekolah Menengah Kejuruan di Indonesia sejak 2014. Kini melalui Mitsubishi Motors Education Program (MEP), MMKSI kembali menegaskan dedikasinya terhadap kemajuan dan pengembangan pendidikan kejuruan di Indonesia, seperti tertulis dalam siaran resmi yang diterima detikOto. Sebagai bagian dari inisiatif berkelanjutannya, MMKSI tahun ini kembali mendonasikan 5 (lima) unit kendaraan Mitsubishi Motors kepada 5 (lima) Sekolah Menengah Kejuruan jurusan Teknik Kendaraan Ringan (TKR) di Indonesia. Penyerahan donasi secara simbolis kali ini dilaksanakan kembali di booth Mitsubishi Motors pada ajang Indonesia International Motor Show (IIMS) 2024 di JIExpo Kemayoran Jakarta pada 22 Februari 2024 kemarin. SCROLL TO CONTINUE WITH CONTENT Kendaraan yang disumbangkan MMKSI terdiri dari model MPV andalan mereka yaitu Xpander dan juga kendaraan niaga ringan yang telah terbukti ketangguhannya, Triton. Kedua model tersebut diharapkan dapat menjadi sarana bagi siswa untuk memperdalam pengetahuan mereka tentang teknologi otomotif terkini berbasis kurikulum Mitsubishi Motors. ""Mitsubishi Motors Education Program (MEP) bertujuan untuk memberdayakan generasi profesional otomotif berikutnya dengan menyediakan sumber daya dan fasilitas penting serta memberikan kesempatan pembelajaran praktis bagi sekolah kejuruan. Melalui donasi ini, MMKSI berupaya untuk meningkatkan keterampilan teknis para siswa dan mempersiapkan mereka untuk sukses berkarir di industri otomotif,"" ujar ujar Presiden Direktur PT MMKSI, Atsushi Kurita. Sebagai pelengkap dari donasi kendaraan praktikum yang diberikan, MMKSI juga akan memberikan pelatihan berupa Mitsubishi Motors Service Technician Education Program (MSTEP-1) untuk 15 siswa dari masing-masing sekolah kejuruan. Program ini akan semakin memperdalam pemahaman siswa tentang teknologi Mitsubishi Motors, membekali mereka dengan keterampilan dan pengetahuan yang dibutuhkan untuk unggul dalam karir masa depan siswa. ""Kami percaya bahwa campur tangan pelaku industri dapat memperkuat pendidikan dan pembelajaran para siswa di sekolah untuk menciptakan ekosistem SDM yang berkualitas dan menguntungkan bagi berbagai pihak. Kepercayaan tersebut pun yang mendorong kami untuk dapat terus membekali sekolah kejuruan dengan salah satu alat penting dalam meningkatkan keterampilan teknis siswanya. Dan melalui donasi serta bekal pelatihan teknisi Mitsubishi Motors yang aplikatif, diharapkan dapat meningkatkan keterampilan teknis siswa dan mempersiapkan mereka untuk karir yang sukses di industri otomotif,"" Atsushi menambahkan. Pelatihan yang diberikan telah mencakup keterampilan teknik dasar otomotif yang merupakan program wajib bagi setiap mekanik Mitsubishi Motors di seluruh dunia. Pelatihan juga akan dilengkapi dengan pemberian pengetahuan dasar otomotif yang meliputi sistem-sistem pada kendaraan seperti mesin bensin atau diesel, sistem bahan bakar, sistem kelistrikan, sistem power train, chassis, dan sebagainya. Untuk memastikan mereka siap dan memiliki standar yang sesuai dengan kebutuhan industri otomotif, dalam pelatihan tersebut MMKSI akan memberikan pengetahuan mengenai pre-delivery inspection (PDI), free service serta perawatan rutin kendaraan. Sebagai tambahan, Mitsubishi Motors Education Program (MEP) pertama kali dilaksanakan pada tahun 2014, di mana Mitsubishi Motors di Indonesia telah mendonasikan total 64-unit kendaraan Mitsubishi Motors termasuk donasi tahun ini ke sekolah kejuruan di seluruh Indonesia yang memiliki jurusan Teknik Kendaraan Ringan (TKR). Tidak hanya itu, di tahun ini pun MMKSI telah memberi bekal pelatihan terhadap 675 orang siswa sekolah vokasi yang dilaksanakan di Mitsubishi Motors Regional Training Center (MRTC) terdekat dengan sekolah masing-masing siswa. Daftar sekolah yang yang masuk dalam program Mitsubishi CSR Education Program (MEP) FY2023. 1. SMK Negeri 1 Koto Baru, Sumatera Barat2. SMK Negeri 1 Jetis, Mojokerto, Jawa Tengah3. SMK Negeri 1 Petarukan, Pemalang, Jawa Tengah4. SMK Swasta Pasundan Subang, Jawa Barat5. SMK Swasta Yasmi Gebang, Cirebon, Jawa Barat ",Oto
"5 Motor Listrik Termurah di IIMS 2024, Mulai Rp 2 Jutaan","Sabtu, 24 Feb 2024 15:07 WIB",https://oto.detik.com/motor-listrik/d-7209748/5-motor-listrik-termurah-di-iims-2024-mulai-rp-2-jutaan,"Ajang Indonesia International Motor Show (IIMS) 2024 jadi tempat yang paling pas untuk berburu sepeda motor listrik. Nah, berikut ini 5 motor listrik termurah yang dijual di IIMS 2024! 1. ZPT Nimbuzz ZPT Nimbuzz. Motor ini dijual dengan harga Rp 2.999.000. Kenapa bisa murah? Karena motor ini sudah mendapat program subsidi dari pemerintah. SCROLL TO CONTINUE WITH CONTENT Kendati murah, secara spesifikasi cukup mumpuni. Motor powernya 1.000 watt, kecepatan maksimalnya mencapai 60 km/jam. Adapun beratnya adalah 89 kg dengan lingkar profil ban 90/90 R10. Motor ini dibekali pengereman disc brake single piston di depan dan teromol di belakang. Motor ini bisa mengangkut beban hingga 200 kg dan menempuh jarak sejauh 70 km. 2. ZPT NYX ZPT NYX motor itu mirip-mirip dengan skutik Eropa. Harga jualnya Rp 4.999.000. Motor ini dibekali motor power 1.500 Watt. Di atas kerta bisa mencapai kecepatan 70 km/jam dan jarak tempuhnya 70 km. Adapun beratnya 99 kilogram dengan lingkar profil ban ring 10 inch dan ban 90/90. 3. Greentech Aero Motor listrik murah selanjutnya adalah Greentech Aero. Desain motor ini mirip motor skutik entry level dengan banyak tarikan tegas. Motor listrik ini seharga Rp 6,9 juta. Greentecha menggunakan jenis baterai SLA removable berkapasitas 72 volt 32 Ah, dengan kecepatan maksimum 70 km/jam dan daya jelajah 88 kilometer. Adapun berat motor ini mencapai 108 kilogram. 4. Greentech Unity Classic Harga motor listrik murah di IIMS selanjutnya masih dari Greentech. Greentech Unity yang dibandrol dnegan harga Rp 5,3 juta. Motor listrik ini dibekali dengan baterai Led Acid berkapasitas 60 volt 52 Ah. Daya jelajahnya menembus 70 kilometer. 5. Greentech VP Selanjutnya masih dari Greentech, ada motor listrik yang dijual Rp 7,5 juta. Motor itu namanya Greentech VP. Di atas kertas Greentech VP menggunakan kapasitas baterai 72V 32 Ah. ",Oto
Suzuki Pastikan Akan Tambah Model Produksi di Indonesia,"Sabtu, 24 Feb 2024 14:13 WIB",https://oto.detik.com/mobil/d-7209734/suzuki-pastikan-akan-tambah-model-produksi-di-indonesia,"Awal tahun 2024 sepertinya menjadi start yang bagus Suzuki Indonesia dengan menghadirkan Jimny 5 pintu yang berhasil menyihir pecinta otomotif. Meski demikian, produsen asal Jepang ini tidak mudah puas dan memastikan akan menambah produk yang diproduksi di Indonesia. Hmm, kira-kira model apa lagi ya yang akan diproduksi di Indonesia? Apa Suzuki Jimny 5 pintu? Direktur Pemasaran PT SIS, Harold Donnel memang belum mau buka-bukaan membocorkan model apa yang akan diproduksi di Indonesia untuk menemani Suzuki Ertiga. Meski demikian kabar ini kian seksi ditunggu, karena bisa menambah pilihan mobil Suzuki dengan harga yang lebih terjangkau. SCROLL TO CONTINUE WITH CONTENT ""Suzuki Jimny diproduksi di Indonesia? Suzuki Indonesia sebagai pilar ketiga suzuki di global, kita terus melakukan upaya tersebut (Agar Suzuki Jimny bisa diproduksi di Indonesia). Hanya memang prinsipal memiliki pilihan-pilihan-nya, produk ini untuk produksi di sini (di negara tertentu), kebetulan wilayah Indonesia itu untuk memenuhi kebutuhan ASEAN, beberapa negara Timur Tengah dan Africa Selatan. Karena produksi kita tidak hanya untuk memenuhi domestik, melainkan ekspor juga,"" kara Harold. ""Ke depannya tidak hanya Jimny, produk lain juga bisa di CKD-kan, gak usah khawatir dalam beberapa tahun ke depan akan ada produk baru yang akan di CKD-kan di Indonesia. Kita sudah siapkan platform-nya, tidak mungkin suzuki Indonesia hanya menerima saja (Indonesia cuma jadi pasar), kita terus berjuang untuk bisa memproduksi di Indonesia,"" Harold menambahkan. Dalam kesempatan yang sama, Asst to Dept. Head 4W Sales PT SIS, Randy Murdoko menambahkan keputusan untuk menjual Jimny di Indonesia, juga tidak lepas dari satu pembuktian Suzuki Indonesia kepada prinsipal bahwa Indonesia merupakan market yang menarik, dan diharapkan bisa memperbanyak line up produksi Suzuki di Indonesia. ""Dalam 2 minggu ini multi distributor dan banyak orang Suzuki Jepang datang untuk melihat bagaimana cara kita memperkenalkan Jimny. Ini biar mereka lihat kita bisa jualan Jimny, dan kita tunjukkan dan mereka lihat. Dan kita akan lebih kuat untuk memperjuangkan, agar bisa memproduksinya di Indonesia,"" kata Randy. ""Tapi memang prinsipal kami memiliki strategi, dan strateginya seperti itu (negara mana yang memproduksi apa), tapi boleh dong kita usaha dan di Cikarang kita punya pabrik besar. Jadi kita setuju kalau Jimny diproduksi di Indonesia pasti akan kece banget,"" Randy menambahkan. ",Oto
"6 Pilihan Mobil Bekas Harga Rp 50 Jutaan, Ada Karimun hingga City","Sabtu, 24 Feb 2024 13:35 WIB",https://oto.detik.com/mobil/d-7209546/6-pilihan-mobil-bekas-harga-rp-50-jutaan-ada-karimun-hingga-city,"Mobil bekas masih menjadi pilihan alternatif bagi masyarakat. Sebab, harganya cukup terjangkau daripada membeli unit yang baru di dealer. Namun perlu diingat, membeli mobil bekas dengan harga yang sangat murah belum tentu bakal mendapatkan unit yang bagus. Jadi, jangan langsung kepincut dengan harga murah, siapa tahu kondisinya malah 'zonk'. Namun jangan khawatir, masih ada pilihan mobil bekas dengan harga Rp 50 jutaan dengan kondisi yang cukup baik. Penasaran? Simak selengkapnya dalam artikel ini. SCROLL TO CONTINUE WITH CONTENT Membeli mobil bekas harus benar-benar teliti. Jangan hanya tergiur dengan harganya yang murah, namun perhatikan juga kondisi mobil tersebut. Apakah masih dalam kondisi sehat, cukup oke, atau harus banyak dilakukan perbaikan. Lantas, apa saja pilihan mobil bekas yang harganya kisaran Rp 50 jutaan? Simak daftarnya di bawah ini: Pilihan yang pertama ada Suzuki Karimun. Mobil yang termasuk Low-Cost Green Car (LCGC) ini punya harga bekas cukup terjangkau di kantong. Dari pantauan detikOto di salah satu situs jual beli kendaraan online, ada penjual yang mengiklankan Suzuki Karimun lansiran 2003 di harga Rp 55,5 juta saja. Lalu, ada juga penjual yang menjual Suzuki Karimun tahun 2001 di harga Rp 49,5 juta. Jika ingin membeli mobil bekas keluaran agak baru, coba lirik Datsun Go Panca. Memang mobil ini sudah berumur 10 tahun, akan tetapi masih cukup oke untuk dipakai sehari-hari. Dengan catatan, mobil yang kamu beli dalam kondisi sehat. Di situs jual beli kendaraan online, terdapat orang yang menjual Datsun Go Panca produksi tahun 2014. Mobil tersebut bertipe 1.2 T-Active bensin dengan transmisi manual. Odometer pada Datsun Go Panca miliknya di angka 85.000-90.000 kilometer. Dengan pajak yang sudah mati 3 tahun, mobil tersebut dibanderol Rp 59 juta. Tertarik menggunakan jip mungil? Suzuki Katana bisa jadi opsi menarik. Sebab, ada banyak penjual yang menjual Suzuki Katana di harga Rp 50-70 jutaan. Seperti penjual Suzuki Katana lansiran tahun 1991 yang harganya sebesar Rp 49,5 juta. Di atasnya ada penjual yang mengiklankan Suzuki Katana tahun 1994 dengan banderol Rp 59 juta. Cukup banyak pemilik yang menjual Suzuki Katana miliknya di harga rendah. Namun jangan langsung kepincut ya, cek kembali kondisi mobil dan mesin sebelum deal. Pilihan selanjutnya ada Nissan Almera. Mobil berjenis sedan ini dibekali dua opsi mesin, yaitu berkapasitas 1.200 cc dan 1.500 cc. Nah, di salah satu situs jual beli kendaraan terdapat penjual yang menjual Nissan Almera tahun 2015 di harga Rp 55 juta saja. Mobil tersebut bertipe 1.5 bensin, transmisi manual, dan odometer di 70.000-75.000 km. Butuh mobil MPV untuk mengangkut banyak anggota keluarga? Nah, Suzuki APV bisa jadi opsi menarik. Sebab, mobil ini sudah banyak dijual dalam kondisi berkas dengan harga cukup terjangkau. Salah satunya ada penjual yang memasarkan Suzuki APV lansiran 2004 di harga Rp 43 juta. Selain itu, ada juga Suzuki APV produksi tahun 2005 yang dijual seharga Rp 54 juta. Honda City menjadi salah satu mobil andalan bagi para pecinta sedan. Kalau harga barunya dirasa terlalu mahal, coba lirik Honda City generasi awal yang harganya sudah murah. Ada penjual yang mengiklankan Honda City tahun 2005 dengan harga Rp 55 juta. Mobil tersebut memiliki odometer di angka 185.000-190.000 km. Lalu, ada juga penjual yang menjual Honda City lansiran tahun 2005 di harga Rp 56,5 juta. Untuk odometernya sendiri di angka 195.000-200.000 km. Itu dia enam pilihan mobil bekas dengan harga sekitar Rp 50 jutaan. Tertarik untuk membeli salah satunya detikers? ",Oto
Serbu! Honda Gelar Program Mudik Gratis,"Sabtu, 24 Feb 2024 13:05 WIB",https://oto.detik.com/berita/d-7209544/serbu-honda-gelar-program-mudik-gratis,"Ramadan sudah yang sudah di depan mata, pasti banyak membuat masyarakat Jakarta bersiap untuk bisa balik ke kampung halaman. Di sarankan bagi masyarakat yang hendak merayakan hari Raya Idul Fitri 2024/1445 Hijriah, tidak mengendarai motor ya, tentu hal tersebut agar perjalanan mudik bisa lebih nyaman dan aman. Menyadari hal tersebut, PT Astra Honda Motor kembali membuka kesempatan bagi konsumen setia sepeda motor Honda untuk mendaftar program Mudik dan Balik Bareng Honda (MBBH) untuk merayakan Hari Raya Idul Fitri di kampung halaman. Dalam siaran resmi yang diterima detikOto, pendaftaran program dibuka sejak tanggal 26 Februari 2024 hingga 2 April 2024 melalui aplikasi resmi Honda untuk memudahkan para konsumen setia Honda, seperti WANDA, Motorku-X, dan juga Daya Auto. SCROLL TO CONTINUE WITH CONTENT Selain itu, bagi konsumen yang ingin mendaftar secara langsung, dapat melakukan pendaftaran ke dealer Honda seperti Wahana - Gunung Sahari, Nusantara Surya Sakti - Slipi, Bintang Jaya - Klender, Wahana - Cipondoh, Astra Motor - Cawang, Mitra Jaya- Kranji, dan Bintang Motor Jaya - Depok. Pendaftaran langsung ini dibuka pada 22 Maret 2024. Calon pemudik yang ingin mengikuti program MBBH harus melampirkan fotokopi Kartu Tanda Penduduk (KTP) Indonesia, Surat Izin Mengemudi (SIM) C, dan Surat Tanda Nomor Kendaraan (STNK) sepeda motor Honda pada saat pendaftaran. Bagi pemudik yang akan mengikuti arus balik, wajib menyertakan KTP Jabodetabek. Keselamatan peserta MBBH selalu menjadi prioritas Utama AHM, untuk itu terdapat beberapa persyaratan di antaranya batasan maksimal barang bawaan sebesar 20kg, sepeda motor dalam kondisi standar, wajib membawa helm SNI, dan pemudik diharuskan turun di lokasi yang telah ditentukan. Setiap peserta MBBH berhak mendapatkan dua kursi bus, pengangkutan satu unit sepeda motor Honda miliknya, asuransi perjalanan, layanan kesehatan, goodie bag menarik, dan konsumsi selama perjalanan. AHM juga akan mengadakan undian dengan hadiah dua sepeda motor,gadgets, dan hadiah lainnya untuk memeriahkan acara. Semua fasilitas ini dapat dinikmati dengan biaya pendaftaran sebesar Rp 150.000. General Manager Honda Customer Care Center (HC3) AHM Antok Yuniarso mengatakan program Mudik dan Balik Bareng Honda secara konsisten digelar setiap tahun sebagai upaya memberikan pelayanan terbaik bagi konsumen setia sepeda motor Honda. Kualitas layanan program ini pun terus ditingkatkan untuk memberikan keselamatan dan kenyamanan bagi konsumen. ""Kami menyelenggarakan MBBH 2024 dengan menambahkan jumlah armada bus dan truk yang dilengkapi dengan beragam pilihan pendaftaran untuk kemudahan pelanggan. Semoga kegiatan mudik tahun ini dapat menjadi momen berkesan untuk berkumpul kembali bersama keluarga tercinta dalam merayakan Idul Fitri ditemani dengan sepeda motor Honda,"" ujar Antok.  Untuk memastikan kenyamanan pemudik selama perjalanan jauh, tahun ini AHM menyediakan fasilitas bus dan truk untuk mengangkut sepeda motor peserta MBBH. Sebanyak 28 truk akan mengangkut 1.100 sepeda motor Honda kesayangan konsumen dengan aman hingga sampai di kota tujuan, diberangkatkan pada 4 April 2024 dari pelataran parkir Bhanda Ghara Reksa (BGR), Kelapa Gading, Jakarta Utara. Selain itu, 59 armada bus akan disiapkan khusus untuk mengantar 2.200 pemudik dengan rute Jakarta - Yogyakarta dan Jakarta - Semarang, yang akan diberangkatkan dari PT. Astra Honda Motor, Sunter pada tanggal 6 April 2024. Untuk arus balik, AHM akan menfasilitasi 22 bus untuk 800 pemudik yang akan kembali ke Jakarta dan 10 truk untuk mengangkut 400 sepeda motor pemudik pada tanggal 14 April 2024. ",Oto
"Sepeda Ini Bisa Tempuh 70 km, Harganya?","Sabtu, 24 Feb 2024 12:17 WIB",https://oto.detik.com/berita/d-7209511/sepeda-ini-bisa-tempuh-70-km-harganya,"Honbike berkolaborasi dengan Selis untuk memasarkan sepeda listrik yang memiliki desain sporty dan premium, dilengkapi dengan fitur Bluetooth terintegrasi dan aplikasi. Sepeda listrik ini memungkinkan menempuh jarak hingga 70 km. Pada ajang Indonesia International Motor Show 2024, Selis meluncurkan dua sepeda listrik terbaru dengan desain yang sangat simple dan berkelas. Sepeda listrik ini merupakan hasil kerja sama dengan Honbike, perusahaan sepeda listrik dari China dan Jepang. Kedua sepeda listrik ini memiliki desain yang simple dan finishing yang sangat mulus. Kedua sepeda listrik yang dimaksud adalah Selis UCO-20 dan Selis UCO 24. Bahkan, rantai di sepeda listrik ini tidak terlihat sehingga sepeda listrik Selis satu ini semakin simple. Rantai pada Selis UCO-20 dan Selis UCO-24 terletak pada bagian dalam frame sehingga tidak terlihat. SCROLL TO CONTINUE WITH CONTENT Sepeda listrik Selis UCO-24 bisa menempuh jarak tempuh 75 km dan Selis UCO-20 bisa menempuh jarak tempuh 55 km. Kedua sepeda listrik ini dilengkapi dengan fitur pedal assist dengan speed sensor. Setiap gowesan dan kayuhan akan otomatis mengaktifkan energi listrik. Dengan demikian, gowesan penggunanya akan sangat ringan. Selain itu, Selis UCO-24 bisa juga digunakan dengan mode throttle alias hanya menggunakan energi listrik, tanpa digowes atau dikayuh. ""Sepeda listrik ini cocok untuk mengikuti segala trend. Sekarang kan memang lagi trend sepeda listrik. Nah, pengguna Selis UCO-24 bisa pakai seperti halnya sepeda listrik. Kalau mau car free day atau olahraga dengan sepeda, bisa pakai Selis U-24 dan Selis U-20. Bisa kasih kesan sporty. Padahal, dibantu sama kelistrikan,"" jelas Romeldo Christian, Marcomm Selis di IIMS 2024, JIEXPO Kemayoran, Rabu, 22 Februari 2024 kemarin. Sama seperti sepeda listrik lainnya, Selis UCO-20 dan Selis UCO-24 memiliki display di bagian depan yang menampilkan kecepatan dan indikator baterai. Lampu di bagian depan juga sudah menggunakan LED sehingga bisa terang di tempat yang gelap. ""Yang hebatnya, kelistrikan di sepeda listrik ini enggak kelihatan. Biasanya di ban belakang sepeda listrik itu ada dinamo yang terlihat jelas. Kalau Selis UCO-20 dan UCO-24 ini seperti sepeda pada umumnya saja. Bahkan, enggak ada baterai yang kelihatan karena baterainya ada di dalam frame di bawah seat. Baterainya juga removable dengan durasi charge 3-5 jam,"" tambah Romeldo Christian. ""Selis UCO-20 dan UCO-24 ini dibekali dengan bluetooth yang bisa disambungkan ke aplikasi di ponsel pengguna. Dengan demikian, pengguna bisa melihat lama penggunaan sepeda, kecepatan, dan juga jumlah CO2 yang dihemat berkat perjalanan menggunakan sepeda listrik. Aplikasi juga bisa menampilkan track yang dilalui dan history penggunaan sepeda dalam periode harian, mingguan, dan bulanan,"" jelas Robin, Direktur Marketing Selis. Kedua sepeda listrik ini dijual di IIMS 2024. - Selis UCO-20: Rp16.999.000 - Selis UCO-24: Rp17.499.000 ",Oto
